<qdata name="qdataa" type="ATTRIBUTE" xmlns:xsi="http://www.w3.org/2001/XMLSchema-instance" xsi:noNamespaceSchemaLocation="QData.xsd">
	<headera name="A Test For The XML-to-YAML Test Converter"
			 author="Bob Hostern"
			 description=""
			 extra=""
			 maxquestions="1"
			 answernumberinput="true"
			 skipoverride="false" />
	<questionsa>
		<problem correctanswer="3">
			<question>What is the square root of 25?</question>
			<answers>
				<answer value="3" />
				<answer value="85" />
				<answer value="5" />
				<answer value="6" />
			</answers>
		</problem>
	</questionsa>
</qdata>
