<qdata name="qdata" type="ELEMENT" xmlns:xsi="http://www.w3.org/2001/XMLSchema-instance" xsi:noNamespaceSchemaLocation="QData.xsd">
	<header>
		<name>A Test For The XML-to-YAML Test Converter</name>
		<author>Bob Hostern</author>
		<description></description>
		<extra></extra>
		<maxquestions>1</maxquestions>
		<answernumberinput>true</answernumberinput>
		<skipisincorrect>false</skipisincorrect>
	</header>
	<questions>
		<problem>
			<question>What is the square root of 25?</question>
			<answers>
				<answer>3</answer>
				<answer>85</answer>
				<answer>5</answer>
				<answer>6</answer>
			</answers>
			<correctanswer>3</correctanswer>
		</problem>
	</questions>
</qdata>
